{
  "schema_version": 1,
  "evidence_revision": "P2-20A.9",
  "captured_utc": "2026-08-30T15:29:04.7099421+00:00",
  "task_id": "P2-20A",
  "criterion_id": "G2-06",
  "source_build": "qy-3.0.0.413",
  "result": "BLOCKED",
  "review_execution_result": "PASS",
  "task_status": "BLOCKED",
  "completion_criteria_satisfied": false,
  "diagnostic_scope_complete": true,
  "scope_complete": false,
  "g2_06_satisfied": false,
  "p3_authorized": false,
  "input_bindings": {
    "aggregate_sha256": "6043b3807eb840355a4e2baff6f2e1fbe36ea146c71b2bb41684eb26c35961a6",
    "entries": [
      {
        "role": "auxiliary_inventory",
        "sha256": "ce440d346053144eae53dead5c2e8fef97c674db211ee8b861baedd17a9daaff"
      },
      {
        "role": "a3_report",
        "sha256": "7486d70b346c8acd1695179dca06b66453850927d8f8cdc4773480ac636fbe45"
      },
      {
        "role": "a3_evidence",
        "sha256": "b9daba01ead89b13c2607044bbcc8c44c9ba23caa4396266ab95399630bc536a"
      },
      {
        "role": "a5_report",
        "sha256": "bdd8802c9f6c5304bdab3183f606923005145c87daf5f4f3208edf14b4cc7cb9"
      },
      {
        "role": "a5_evidence",
        "sha256": "53bcd36a1090618a6d3744250247382c304bbcad93a7e3fbb1ed6a7bf58442df"
      },
      {
        "role": "package_inventory",
        "sha256": "ac6671219c41324f1e7aac0a1cd5c08a9dc66f7c75e30cd3081610c038a26d16"
      },
      {
        "role": "asset_inventory",
        "sha256": "a85f564297dfc3ca8d30050df5094838d9dea49c448686453aba0eb9252a6a7c"
      },
      {
        "role": "reference_closure",
        "sha256": "3d69c8a7a8f96bce8d51687baf5862e924562211c7b803518b6fb4d1623d9962"
      },
      {
        "role": "policy",
        "sha256": "0592d2c84883a06442f7056063b9d222550ce0b78f445685b3e7e78d3459a024"
      },
      {
        "role": "schema",
        "sha256": "0027701728f3fceefc0d8e786a99fd0712d9823d758082e33c4a8313fd963faa"
      },
      {
        "role": "detail_schema",
        "sha256": "2e1d9330119f074dfa93191e35e7182dc40fba77820a5ebd18478ddf1b362897"
      }
    ],
    "ignored_artifacts": [
      {
        "role": "a3_detail",
        "path": "Data/Exports/P2-20/p2-20a-aux-config-reference-candidates.jsonl",
        "bytes": 3321747,
        "lines": 3907,
        "sha256": "109ba4364c8716d040528769ab33ebdc8da43ac48307c3a17822387ea644d4d5",
        "tracked": false
      },
      {
        "role": "asset_catalog",
        "path": "Data/Exports/P2-12/p2-12-full-asset-inventory.jsonl",
        "bytes": 16802213,
        "lines": 40090,
        "sha256": "7d3666a130b94863323ddd16cf25edeb9a7e0be6a5b34809d9b7345ab3644a92",
        "tracked": false
      },
      {
        "role": "reference_graph",
        "path": "Data/Exports/P2-13/p2-13-reference-closure.jsonl",
        "bytes": 205392166,
        "lines": 683355,
        "sha256": "6d895d722d8a547c8c1c560a8c68750ae98b83b458e27836befac18cf496c9ed",
        "tracked": false
      }
    ],
    "legacy_sources": [
      {
        "role": "object_and_package_resolver",
        "sha256": "1f10ae3b06062564ac283a9396b1d232c261c669bcd6c22271b414aa6d6323e5"
      },
      {
        "role": "package_object_reader",
        "sha256": "b4abf66d3f84f583f80f88b70c44e7c90fcac9fd380c34f08f398cf3e8ccd064"
      },
      {
        "role": "recursive_package_lookup",
        "sha256": "2541318310e369536f7c13ef1f1486dd1456b57349d703bd2b8fb4d02741ac69"
      },
      {
        "role": "region_consumer",
        "sha256": "a1e5d33643d633234b2eeb07c6dc9358814d9802d4a9f43c959c1a4b155f1853"
      }
    ]
  },
  "strict_baseline": {
    "region_instances": 135,
    "unique_total": 3180,
    "unique_file": 3042,
    "unique_object": 4,
    "unique_package_root": 134,
    "ambiguous_object": 211,
    "ambiguous_candidate_edges": 422,
    "divergent_ambiguous_bodies": 211,
    "unresolved_resource": 1,
    "first_candidate_selections": 0
  },
  "measured": {
    "source_instances_verified": 212,
    "region_instance_partition": {
      "strict_clean": 5,
      "strict_ambiguous_only": 129,
      "strict_ambiguous_and_unresolved": 1
    },
    "package_context": {
      "preexisting_unique_verified": 4,
      "ambiguous_attempted": 211,
      "original_candidate_edges": 422,
      "singleton_matches": 211,
      "zero_matches": 0,
      "multiple_matches": 0,
      "selected_edges": 211,
      "incompatible_context_edges": 211,
      "order_invariant": 211,
      "first_candidate_selections": 0
    },
    "effective_resolution": {
      "total_occurrences": 3392,
      "resolved_total": 3391,
      "resolved_file": 3042,
      "resolved_object": 215,
      "resolved_package_root": 134,
      "ambiguous_object": 0,
      "ambiguous_candidate_edges": 0,
      "unresolved_resource": 1
    },
    "effective_region_instances": {
      "resolved_only": 134,
      "unresolved_resource": 1
    }
  },
  "consumer_controls": {
    "selection_basis": "PRODUCTION_PACKAGE_CONTEXT_PREFIX",
    "strict_region_consumer_fields_only": true,
    "frozen_strict_candidate_sets": true,
    "package_prefix_from_observed_consumer_context": true,
    "package_prefix_exact_complete_component": true,
    "global_package_basename_unique_required": true,
    "full_object_name_exact_match_required": true,
    "ascii_case_fold_only": true,
    "candidate_order_invariant": true,
    "selected_candidate_must_be_frozen_member": true,
    "all_incompatible_candidates_retained": true,
    "first_candidate_selection": false,
    "heuristic_path_selection": false,
    "content_body_equivalence_selection": false,
    "root_inference": false,
    "shadow_instance_collapse": false,
    "zero_reference_is_no_ref_approval": false,
    "technical_proof_is_authority_approval": false
  },
  "technical_state": {
    "package_context_contract_proven": true,
    "ambiguous_object_targets_remaining": 0,
    "unresolved_resources_remaining": 1,
    "consumer_clean_region_instances": 134,
    "semantic_adapter_approved": false
  },
  "authority_state": {
    "approved_consumer_contracts": 0,
    "approved_semantic_adapters": 0,
    "approved_no_reference_instances": 0,
    "approved_roots": 0,
    "terminal_instances": 0,
    "nonterminal_instances": 212,
    "ordinary_development_authorization_is_semantic_approval": false,
    "technical_resolution_is_semantic_approval": false
  },
  "preserved_blockers": {
    "ecf_parser_parity_gaps": 3,
    "ecf_assignments_missed": 4,
    "malformed_instances": 6,
    "approved_roots": 0,
    "nonterminal_instances": 212,
    "config_edges_unapproved": 8
  },
  "blockers": [
    {
      "reason_code": "UNRESOLVED_RESOURCE_TARGETS",
      "count": 1
    },
    {
      "reason_code": "LEGACY_PARSER_PARITY_GAPS",
      "count": 3
    },
    {
      "reason_code": "MALFORMED_INPUTS_UNDISPOSED",
      "count": 6
    },
    {
      "reason_code": "APPROVED_ROOT_SET_EMPTY",
      "count": 0
    },
    {
      "reason_code": "CONSUMER_CONTRACTS_UNAPPROVED",
      "count": 212
    }
  ],
  "negative_contracts": [
    "FIRST_CANDIDATE_SELECTION_REJECTED",
    "ZERO_OR_MULTIPLE_PREFIX_MATCH_REJECTED",
    "CANDIDATE_ORDER_DEPENDENCE_REJECTED",
    "CANDIDATE_SET_TAMPER_REJECTED",
    "SELECTION_OUTSIDE_FROZEN_SET_REJECTED",
    "INCOMPATIBLE_EDGE_DROP_REJECTED",
    "NON_PRODUCTION_PREFIX_REJECTED",
    "STRICT_BASELINE_REDUCTION_REJECTED",
    "UNRESOLVED_RESOURCE_ERASURE_REJECTED",
    "ROOT_OR_APPROVAL_INJECTION_REJECTED",
    "SHADOW_INSTANCE_COLLAPSE_REJECTED",
    "MISSING_OR_UNKNOWN_FIELD_REJECTED"
  ],
  "detail_export": {
    "tracked": false,
    "path": "Data/Exports/P2-20/p2-20a-aux-package-context.jsonl",
    "lines": 135,
    "bytes": 161055,
    "sha256": "fc2bcf49e2868d1c3a3770da351ed1432fabcd2433d1df53f8c9c071ecc17f8e"
  },
  "g2_projection": {
    "criteria_total": 9,
    "satisfied": 7,
    "blocked": 2,
    "g2_decision": "BLOCKED"
  },
  "contracts": {
    "policy_sha256": "0592d2c84883a06442f7056063b9d222550ce0b78f445685b3e7e78d3459a024",
    "schema_sha256": "0027701728f3fceefc0d8e786a99fd0712d9823d758082e33c4a8313fd963faa",
    "detail_schema_sha256": "2e1d9330119f074dfa93191e35e7182dc40fba77820a5ebd18478ddf1b362897"
  },
  "disclosure": {
    "tracked_aggregate_and_hash_only": true,
    "anonymous_detail_only": true,
    "raw_values": false,
    "key_names": false,
    "file_names": false,
    "private_source_paths": false,
    "source_line_numbers": false,
    "legacy_source_lines": false,
    "exact_primary_keys": false,
    "decoded_payloads": false
  }
}
